,Month,Original,Summary
0,2023-01,Mantap Tokopedia semoga sukses kesini aplikasi lapak isi penipu berkedok seller    akun seller palsu    jual barang wilayah A dikirimnya wilayah B   pengiriman  ujung²nya barang yg barang  mohon tokopedia tanggapi sengan serius  Block akun yg alamatnya sesuai   Menggangu iklsn mulu lumayan memudahkan metodemetodenya  Harga ongkirnya ga ngotak benget mantap cepat  kurir sicepatsilambat 3x transaksi 3x ngajuin komplen karna paket terlambat kurir rekomendasi  mohon tokopedia Nyoba dl tolong hilang in feed rekomendasi gangu banget  kayak spam  toko yg follow ketutup rekomendasi feed  klo abis buka produk wishlist kerefresh  udah cape2 scroll ampe keulang keatas lgi menemukan fitur point loyalitas memuaskan Salam sejahtera gokillll Tokopedia gak cod ya    produk spesial WIB  perempuan pakai BH  keluhan   Ekspedisi yg bekerjasama skrg belom diganti telat pengiriman nya keburu dipakai barang nya tpi gak 2 mantap mantap ok good Awesome Belanja Happy update tdk cek saldo topup emoneyflaz  sebelum²nya lancar  Tolong perbaiki  Thx Masukan menu PEMBATALAN PESANAN mode Bayar COD  Penjual tdk merespon  klik BATALKAN PESANAN ko batalnya nunggu persetujuan Penjual  Ahirnya si penjual ya melanjutkan pesanan proses  Takutnya udah pesan produk toko  produk yg BATALKAN dilanjutkan prosesnya  jd dobel klik BATALKAN PESANAN penjual mengkonfirmasi ya langsung batal pesanan  mencontoh aplikasi s     e yg oren  Bagus ok top markotop mantap Wkwkwkw konyol bet Tokopedia  Checkout cancel sistem 3x Gaada salah  memuaskan mantabbbb Udah gak asik belanja  Udah gak discount nya  belanja enak tetangga sebelah  Sebulan belanja tokopedia belasan juta sebulan  sebulan cm ratus ribu aja  Enakan belanja tetangga sebelah  lihat tokped bertahan tinggalkan consument nya  download gak downloadnya ehh ujung  gagal  taik Eror nya ga slesai² Gbisa liat komen gbisa rating produk Dikit² eror dikit² eror Mantap Tokopedia nya bagus  tokopedia kerjasama kurir lambatlambat  jualnya cepat mengirim ok tertipu salah toko naungan tokopedia  jelek  muncul fitur gratis ongkirnya trus pengirimannya diperlambat trus  kecewa sih mantap kesini jelek layanannya Paket telat dikirim kurirnya niat ngrim gk sih woibuang buang aja ngehang restart mantap bagus Wii  parah sepi aja Ga hoky  Aplikasi Tokopedia harganya sesuai bentuk barang nya  asli palsu  suka  dowload pakai Tokopedia bikin kecewa  ongkirnya codnya sesuai aplikasimisal aplikasi hp 30rb suruh bayar 33rbini  hati  pengiriman ninja Xpres  antaraja kurirnya mengambil keuntunganmohon bersangkutan pelanggannya kecewa recomendeeeeed   Bagus Babiiii Payah cashback gak cair ok nih pengguna android iphone bedakan mantab Eror trus Tokopedia pdhl sya ambil uang tokopedia hsil penjualan susah bnr memuaskan good okeeeeee hati hati tokped  beli barang udah sebulan hilang  duitdana gak ganti ganti tokopedia log in  ribet mending shope aja apk buruk Mantab Mahal biaya layanannya gede banget Joss gandos murah meriah ongkir bersahabat gak mahal good Bruh filter nya gk  aja gk ngaruh jos dah tolong jaga rahasia customer penjahat yaa ngapain belanja ditempat ribet apk lelelt promo g gabung  kadang cashback g cair mlah bilang mencurigakan  pindah aja ecomerc pasti2 aja ok mntap DEAR PELANGGAN TOKOPEDIA KURIR  GOJEK  MENGALAMI SUSAH MENGHUBUNGI PENERIMA PAKET TOKEP  MOHON MENCANTUMKAN NOMOR ASLIDI ALAMAT APLIKASI GOJEK MENYAMARKAN NOMOR YG SULIT KURIR MENGHUBUNGI aplikasi nya bagus ringan  nice Manu tokped Belanja murah dn nyaman mantap Marketpleace ang menyusul JDid memudahkan bagus Bug parah  fitur affiliate gk  dikit dikit main banned Kecewa tolong min perbaiki bener  penjual rugikan pesenan sampe penerima stastus  shipping  update sampe 6hari kejelasan ny nungu 2x24jam sampe 6hari tolong kerja ny donk toko pedia pertegas toko2 nya pengiriman nya lambat banget kembalikan promo  bebas ongkir terpisah cashback bagus cepattrimakasih tokopedia top  pokoke  pengguna aplikasi kecewa  Nice pengiriman lambat next day 4 haru ga  ga dipantau tokopedia Skrg aplikasi nya bagus ya  sorry not sorry  Order tgl 22 jan  31 jan blm sampe untungnya beli makanan  direview ulang ekspedisi yg bekerjasama ga bikin pembeli kecewa  Pelayanan cs tokopedia buruk respon  menyelesaikan bertanggung checkout gak  Gara  Ganti nomor  Udah seminggu dikonfirmasi  Lemot bat ni apk  Uninstall aja Semoga Sukses Terima kasih Tokopedia Pengantaran tokopedia lambat sistem plus   Mendingan kayak  udah bayar jgn main cancel  tokopedia ngasi promo gk niat uninstal tokopedia  beli beneran dibilang manipulasi gratis ongkir  ga diapus aja klo ga dipake  Beralih shopee yg ga sensitif muanapz mantap cash back Barang dipesan dibatalkan sistem  gak niat kasih voucher tu bilang  php kapok belanja d tokopedia  kemarin pake jasa anteraja sampenya  skrg pake sicepat jg samanya  ecommerce ngasih pilihan ekspedisi tp gak milih  jos joss no1  online shop terpercaya  Quality guaranted  senang membeli barang mahal seken tokopedia  jual barang seken jugatp cicilan pay later jath tempo tgl 1  gajian tgl 1 tgl 2harusnya jatuh tempo pembayaran tgl 5 aja  pembayaran lega dikit  beli barang Mahal ratusan ribu liat bunganya jg yg tenor setahunjgn terjerat kredit kawanlebih bijak  oya aplikasi skrng jg berat lemot  pengguna dianggap  bagus  bermanfaat  UC yu d dr UU y xx xtcxe rx downgrade banget tokopedia dr bebas ongkir gabung voucher cashbak  pengiriman lambatmungkin beralih market place  pake promo melanggar ketentuan  mnding yg sebelah gratis ongkir udah gitu promo mantaf Jadikan BA plis bang Keribetan bertransaksi voucer ni suka  Krn bonj tuh hemat bgt Sistem Tokopedia  memprioritaskan penjual konsumen  penanganan  kalah pelayanan shoope lazada  bianya ongkir nya cargo mahal  mempermudah belanja the best langganan full blanja toped  gratis ongkir syarat bnyk bgt  udah gt program dilayani Tokopedia jg ttp kena ongkir  solusi barang   pake kargo gratis ongkir  olshop dg sistem terburuk Alone mantul gampang belanja tokped kasih bintang 5 Brooooo kali belanja brooo  ongkir kali kasih murah  Thx Tokopedia And Enaknya Bayar Pakai Gopay rekomendasi kurir gratis ongkirnya memuaskan ekspedisi anter aja yg cenderung memproses barang terima konsumen  mohon evaluasi  simple cepat Penanganan customer carenya parah  berbulanbulan kepastian solusi  tibatiba chat ditutup  Difollup jawabannya  udah kaya copy paste  good job beralih MP  customer care banget gak kasih solusi dibilang customer care  customer support kalo support kasih solusi Customernya  Promo cashback dipakai bersamaan gratis ongkir belom admin 1rb pas2in nabung emas  males Tokped  langganan d tokped alhamdulilah lancar lancar Saran aja tokped sediakan picture payleter nya kaya aplikasi aplikasi sebelah menyediakan picture payleter nya Tokped   gini gini aja yg ketinggalan aplikasi sebelah Terimakasih mudah  promo  pake GOPAY OK good suka belanja online  mudah praktis  tambahkan ulasan  tolong bebas ongkir nya diperbesar  biar pelanggan betah menikmati produk produk ditokopedia  tks Top abisz potongan seller gedeee  potongan rampok uang seller   Potongan udh gede tp ttp kudu beli iklan  Gila nih aplikasi sbntr lg potongannya 50   kurir Sicepat kaga  return 3 kali 3 kaga konfirm udah samoe belom lokasi  kaco dah kaco tokopedia transaksi online perdana sy nih  terpercaya Fitur C,pake promo melanggar ketentuan  mnding yg sebelah gratis ongkir udah gitu promo mantaf Jadikan BA plis bang Keribetan bertransaksi voucer ni suka  Krn bonj tuh hemat bgt Sistem Tokopedia  memprioritaskan penjual konsumen  penanganan  kalah pelayanan shoope lazada 
1,2023-02,Duit masuk  barang kemana jual barang aja gagal  konyol nih apk  pdhl sinyal full 4G  aplikasi uda versi update  aja gagal  produk  aplikasi sebelah lancar jaya  kali nyoba upload barang ijo langsung dpet moment kek gini  otomatis langsung gua playstore ngasih nih apk bintang 0 kalo  ok Kegunaan promo 30rb ya  Kirain dipake  pas udah selesai pembayarannya ditolak saldo dikembalikan  hadehh udh apknya berat bnget kirain promo 30rb pengguna barunya dipake trnyata zonk  Hadeh rugi bbgt Customer service berbelit2  gak solusi   Oke Menyesal download Tokopedia Maaf knpa ya kali check out ko gagal jaringannya bagus fine² aja gangguan dirumah toped yg munculdilayar loading sinyal luber kuatparahhh gaada sistem cod ya  knp srkg ga komplen barang  berkali2 gagal trs  coba install ulang ga masuk  payah  penjemputan pick up satria  antaraja  perbaiki gak sesuai  toko buka  jm 9 7 mlm toko yg tuju udah tutup  Bsok pick up pick up ulang Tokopedia bebenah  manjakan lg customer  Jgn dpt gratis ongkir aja  cashback  penjual jg pembeli tokopedia  beda banget tokopedia yg  dpt cashback yg lumayan  yg pilih gratis ongkir ya gk dpt cashback  pilih cashback ya gk dpt gratis ongkir  tertinggal marketplace sebelah seller kena banget imbasnya 23  turun penjualan  iklan ads on trus  yg view dikit membantu Aplikasi BABI  buka toko  jalan  ad transaksi  tetiba moderisasi permanen  cs perilah alasan pastinya  menyalahi aturan nomor sekian  Iya udah tau notif tulisannya  mksdnya alasan pastinya BABI   apanya dilanggar   Gua menemukan kesalahan sesuai aturan  Eh jawabannya tetep ngambang  Emang BABI  Kembangkan kak anyep Tolong jasa ekspedisi anter aja reguler hapus aja  ganti  pengiriman  lelet  bikin kecewa buyer Pesanan dibatalkan tokopedia dana yg dikembalikan berkurang GILA LO NDRO mantap Makasih ya diskonnya super waw  Alhamdulillah barang memudahkan masak emang  headset harganya murah barang nya rusak gpp intinya makasih Pilihan pembayaran eror  gk kayak oren Mitra Tokopedia  bisnis digital grosir  Sukses mitra  Bagus flash sale tokopedia  checkout 3 barang  dibatalkan alasan salah harga  menunggu 14 refund  Kesalahan seller tokopedia buyer kena imbasnya  gratis ongkir sulit cashback pelit pelayanan cs sok elite  Leryani Valentine makan ram banget in system cod males gua kalo gak cod nya kasihan gak rek ATM yg males bayar Alfa dll kali transfer AlfamartIndomaret mesti batalkan sistem ngga toko sebelah langsung  Pengiriman via TF susah  tinggal pelosok  jarang lwat via tF account  dn tf Belanja bs lbh hemat Toped peliiiiiiiiiiiittttt  Peliiitttt  Peliiiitttt  Najis udah g solusi  uang g d refund  d tlntarkan jg   enak blnja d shopee klo kndla lnsung d sleseken dg win2 solusi g hrus nunggu lma lgi 7 hri krja   PELAYANAN BENER  NOH ORANG ILANG 28JUTA GA LU URUSIN tau ngalamin  menekan tombol  Urutkan   Kode Error   diupdate versi terbarupun  ngalamin harap diperbaiki  Jod Apk jelek uang sy hilang hapus Download uangnya hilang Tolong orderan toko pedia    barangnya yg masuk akal    yg bsa angkut sma motor     jngn barang gede  pke motor Aneh  Pdhl dftr batalkan pesanan  kesamaan identitas   mananya Filternya error niih NPE8OR Hati hati guys Tombol rating mohon ditambah rating kurir  pilih layanan nextday SICEPAT keterangan terlambat uang  buktinya paket 5 tindak    klik tombol komplain gada gunanya  robot dipersiapkan merespon keluhan ttg kurir  Tolong tambahin fitur ngasi rating jasa pengiriman  udah 2x pake Sic    t melebihi estimasi barang sampe  komplen seller jg kasian yg salah ekspedisinya  komplen ekspedisi tp gk ngasih rating diaplikasi  Fitur Cod berlaku Mantap senang memakai Tokopedia karna ringan pengiriman cepat Maru mencoba  Diskon ilang kena batal  Kecewa banget  limit gopaylater engga update dashboard tokped  udh 2 kali kek gini  Ok Respon cs buanget smpai 10 menit gaada respon  direspon responnya maksa banget isi formulir pelayanannya cuek  dana pengembalian pembatalan pesanan banget nunggu 1 kerja  uangnya 5jt  dianggep gabutuh tuh uang 5jt cuman 1 kerja nyairin uangnya bank buatku 1 kerja tuh banget  mending aplikasi oren secepet kilat respon CS nya pencairan dana pengembaliannya Good Terima kasih Sayang  ditokopedia yg namanya bantuan kendala seller ngaco  dm ig  ga respon bantuin  Gini ya beli barang disitu suda tertera rapi biaya expedisi rupiah  memilihnya  seller nya chat  biaya tambahan 100rb ongkirnya  Whattt   kaget  udah chat tokopedia ga direspon  udah kali aja gw beli  Selebihnya uninstal coba jualan  pembeli 1 jam pesanan selesai dikomplain biar dana ketahan  seminggu pembeli nggak kabar  Enak ya beli barang menit2 dana cair dikomplain biar dana ketahan ngilang deh  ngebantu bgt Voucher pilih salah  gk pakai berbarengan  Gratis ongkir  pake siLelet estimasi  Penyelesaian pengiriman barang cepat toko amanah kurir ramah terimakasih Tokopedia searching didalem toko sortir  pencet tombolnya error code  NPZ8BH  nya belanja baik² aja  tumben belanjaan yg laaaaama nya ampun  gk yg hubungi  gk nyalahin toko nya  tp kurirnya komitmen kerja  jelas² paketku udh denpasar dr tgl 24  smpek tgl 28 gk nyampek² rumah  emg nya tuh kurir gk baca alamat ya  keliling bali   denpasar sm rumah gk nympek sejam lo preset tabbun ml berdua J os dipakai bolak browsing macet  adakah fitur autorefreshnya   download aplikasi buruk jelek payleter beli emas beli hp  ongkir mahal mending belanja tik tok gratis ongkir real senang aplikasi tokopedia memudahkan transaksi online  aneka produk ditawarkan beragam penyelesain cepat terbantu beda aplikasi mengalami kendala jawabannya template  jelek     Tokopedia gajelas  Gopay coin pajangan  ga dipake belanja beli pulsa  Pengalaman kali belanja Tokopedia  stock harga tersedia fix  sellernya chat bilangnya stocknya kosong  5 menit stock ready harganya dinaikkan  pas chat harganya 12juta  checkout harganya dinaikkan 13juta  gimana sih konsepnya      Naikkan bintang dah penanganan komplain  BELANJA TOKOPEDIA PENGIRIMANNYA 1 MINGGU   KAGAK BANGET ANJIIRRR      CAPEKNYA GUA NUNGGU    UDAH GAK KAYAK     1 MINGGU BELOM NYAMPE gini  Pas buka Apk Muncul iklan belnja WIB 20000 bebas ongkir Pas klik menu WIB nya  pilih produk yg harga 20000an ga gratis ongkir tuh  Mohon pertanggungjawabkan sesuai Iklan aplikasi  namanya pembohongan kalo iklan pas klik ga GG Barang ga sampe  pengiriman ga kek Terpercaya pengiriman tgl 15 pebruari tgl 27 blum  dikemanakan barang  pembayaran COD  gak barang tolong kembalikn uang yg mendengar kisah anita feng jijik CS nya respon  marketplace nya buruk penipu  Jelek pelayanan nya  Jgn beli Semoga bermanfaat  Terima kasih ya login diarahin halaman buka toko jualan  back Hati  uang hilang 28 juta  Wkwk memuaskan uang kembalikan gedenya aplikasi gk mengkordinasi kurir pelapak nya Gk dibayar ditempat aplikasi nya bagus  intinya bintang 1 user TOKOPEDIA  dr skrg hapus aplikasi  aplikasi yg g seribet tokopedia  Penanganan kendala yg bertele² n  Proses retur barang butih 15  Membingungkan tdk lazada tdk COD bara,namanya pembohongan kalo iklan pas klik ga GG Barang ga sampe  pengiriman ga kek Terpercaya pengiriman tgl 15 pebruari tgl 27 blum  dikemanakan barang  pembayaran COD  gak barang tolong kembalikn uang yg mendengar kisah anita feng jijik CS nya respon  marketplace nya buruk penipu 
2,2023-03,Sepp Belanja gagal  Bayar masuk refound tarik saldo pembatasan nominal  mantap Pembeli dirugikan kurir bermasalah pengiriman  biaya ongkos kirim dijatuhkan pembeli ganti rugi Keren2 pokoknya  akun penjual yg nggak banned blokir aja biar nggak nyusahin orang  sukses toped aplikasi berguna moga aplikasi yg menguntungkan pembeli penjual  amin  Tokped care nya   koin Sherit nya bohon Apajdvdjsts g COD syalan lu ayo kta berantem  ui nya cocok  but at the end of the day is about price  cashback  ongkir dll  So   diperhatikan tokopedia  pindah user menengah belanja mudah ribet  add list kadang si lapak ready  tau  si penjual no proses barang ditingkatkan si penjual enak  terimakasih penguna setia Tokopedia Tokopedia evaluasi rekan jasa kurirnya  Pengiriman  klo gratis ongkir pengiriman hilangkan program  Kalo rekan penjualnya Tokopedia banding platform sebelah yg biru  klo jasa pengiriman nya salut platform si biru mengecewakan  klo Tokopedia mengevaluasi rekan kurir nya kedepannya yg pindah platform sebelah  bermanfaat Betapa ribetnya proses transaksi Belanja aplikasi pembatalan menunggu konfirmasi si penjual  Ok Sip sip sip Aplikasi tlol mempersulit Tolong ditertibkan seller Entree suplier  pedagang curang  liat yg komentar yg dikirim barang nya 0 cepat semoga amanah bagus Blm pake gratis ongkir 20rb tp dianggap pake akun tertera kuotanya  admin kayak ngobrol tembok  konyol yg dapet  perusahaan gabung bagus rusak CSnya yg kayak SDM RENDAH  Klo maju  buang CS skrg  ganti tingkatkan kualifikasi penerimaannya  minimal S2 biar ngotak good Aplikasi ga  daftar potongan 30rb  Pas pakai beli barang pembayaran pakai gopay  udah bayar tulisan pembayaran  Pembayaran BNI  Lawak emang  Pas batalin dinotif uang dikembalikan gopay voucher hilang  bagus banget wajib coba Tokopedia good Bagus oke Semoga cepat bangkrut membantu Tokped mahal  gratis ongkir dikurangi 20rb aja  biaya admin  dahlah pindah sebelah aja Mantap kecewa belanja Tokopedia  barang beli memuaskan  barangnya original   Saran beli barang  cek bintangnya cek penjualannya  cek komenan konsumen   Cari penjualan 100 deh Gue jamin ga gagal bagus mudah si oyen  kelengkapan barang si oyen Tolong ditertibkan seller curang  Enter Supplier barang komplain bibalikin  kenyataan nol  thanks Tokopedia Beli tokped biar dpt cashback  barang diterima eh casback ngak masuk  good bye tokopedia  uninstall aja  tokopedia dah gak asik  bye bye  Masuk halaman gak masuk bagus point  cashbacknya membantu bgt  belanja hemat  tampilan aplikasi nya user friendly  thx u Tokopedia Tokopedia top  bagus banget berbelanja update versi terbaru membantu good Transaksi kali batal bro ok gtw  tpi udh testi 28jt ga bagus  voucher nya parah  beda bgt aplikasi sebelah  toko pedia barang palsu Tokopedia habis update ko Lola ya Terbaik Sengaja d persulit ad returan  bertanggung   it kesalahan penjual yg ga sesuai BRG yg dikirim SMA yg d foto deskripsi  ny sbgai admin bertindak dgn BKN d persulit  kecewa bgt pokok ny  mending shopee aj bli BRG ny return susah  ribet aplikasierror trus komplain aja  gambar  video ga d update yes good good Aplikasi mati diinstal App tokopedia gak menarik kayak shopee lazada  dimana barang2 yg dijual harga murahklo tokopedia barang2 mahal semuaunistal aja Bagusss cepat murahh mantap direkomendasikan  pengirimn lelet  bogor subang 5hari blm nyampe  komplen susah maaf maaf mulu mohon tinggu mohon tunggu mulu un instal dah   pindah aplikasi toko sebelah  bye bye  Kupon nya byk yg ga sesuai dgn yg btuhkn  jd ga pake yg potongan Ongkir Rp  40000 pulau  ganti kebijakan  tolong beritahu pelanggan  Udah seminggu info  mudah penggunaanya Ga banget aplikasinya  order pas dapet promo pengguna  trus order yg dibatalkan dr sistem melanggar s  k  Pas chat udh ga dapet promo lg krn pelanggaran  Laaah pelanggaran  order jg sesuai prosedur aplikasinya  pake promo jg cm pilih 1  pembayaran jg sesuai sm dipilihannya  Pelanggaran coba  Gajelas banget  nyesel download  Pengiriman lamaaaa update bagus cepat  mantap Min Gak Ya Gratis Ongkir nya diskon ongkir mahal banget potongan ongkirnya  update gambar barang muncul lambat mencoba pakai tokopedia  bagus diterusin  jelek ya hapus applikasi dimohon develop  muncul  Produk tdk tersedia android   produk jngan dibeda²kan pengguna androios sprti sblah  gratis ongkirnya pelit  Ayo berkembang flexible upgrade  mantap tokopedia meluncurkan versi update terbarunya app tokopedia langsung dibuka didalamnya tersisa point transaksi  ni perangkap gagaltidak install Google play store   Parah skrg gratis ongkirnya 20rb  kebanyakan org yg belanja jawa yg ongkirnya sampe 40rb  Garagara ongkir ngak beli barang tokped mending nyari pasar aja  Kecewa berat Ok Apk baguss Fix pindah aplikasi aja  mantap bang biarlah bintang yg menilai  pokoknya mantap Mudah cepat Refund dana ribet banget Udah ga free ongkir 20rb  Pindah shopee aja deh nyoba apk karna pngn tuker hp  tpi pas ngecek spek hp yng dituker bngt muter² trs Kog gak diinstal ya  Aplikasi Tokopedia berat  buka 15 menit auto force close  ribet buka ulang aplikasinya  Geratis ongkir y dah cuman potongan 20 ribu ok nyesel download aplikasi tokopedia bagusan shopee pengiriman shopee cepat gratis ongkir kalo tokopedia pelit gratis ongkir barang dipesan banget datengnya payah banget pas klo bayar eror bikin emosi mantab tokped penyambung penjual pembeli mudah cepat Aplikasi yg membantu Smoga Bebas ongkir belanja 20000 opoolah   Kenyataannya belanja minimal 100000 free ongkir    GA NGERTI SISTEM PENGIRIMAN TOKOPEDIA KURIR JEMPUT PAKET ANTERAJA  KURIR PENGANTARAN BERUBAH SICEPAT TOLONG DIPERBAIKI SISTEMNYA PESANAN 1 6  MELEBIHI BATAS ESTIMASI Barang Tokopedia mahal harganya gila2an beda lazada suka aplikasi shopping belanja ditokopedia alhamdulillah dpt gula seharga 3100  Parah nih aplikasi  mengecewakan Tokopedia kalo emang ga niat kasih gopaylater ga ngasih iya mao pake gopaylater pas verifikasi pembayaran nya udah masukin pin yg bener abis ituh loading muter muter doang udah nunggu berjam jam ga jugaa sinyal bagus     coba 1  update  2  Tampilan buka kotak kejutan mengganggu  dibuka hilang dr layar  hilangkan deh  3  pakai 2 aplikasi belanja  Jdid tokopedia  tinggal Tokopedia  sayang Tokopedia pakai cicilan kartu kredit biayanya lumayan  Jdid cicilan sd 3 biaya benarbenar 0   4 semoga Tokopedia dengar saran masukan konsumen  Terima kasih  Salam sukses Ok Pelayanan bagus potongan seller  Berjalan lancar  Tokopedia skrng sdh berbeda dgn Tokopedia sebelum²nya  skrng harga² yg mahal  promo bebas ongkir nya jg  berbeda dgn aplikasi sebelah halo  sadar buka pesan email hp  email dipakai orang pembayaran PEGADAIAN  orang bernama DHIKA AYU WULAN SARI  login aplikasi tokopedia email tsb  email   karna nomor telepon yg aplikasi tokopedia tsb nomor orang LANCANG EMAIL  tokped amanah menjaga identitas orang    Sring eror Gila gila gila loading loading  langsung hapus aja  apk eror Tolong adain fitur COD doang biar enak belanjanya Kak gimana sih CC ga ya  Pengiriman lambat mengerti pembayaran nya Tolong ekspedisi REX dihapus aja min  gajelas sumpah paket Jakarta nyampe  udah Minggu gak nyampe nyempe    Asu foto ulasan gabisa  ya Bagus ok Susah banget COD Tokped barang dijual COD pas metode pembayaran gak  Aplikasi Dah bikin sistem kayakak taiiii  erroran  Mantap siiip Nomor telpon gausah sembunyi²ka,Berjalan lancar  Tokopedia skrng sdh berbeda dgn Tokopedia sebelum²nya  skrng harga² yg mahal  promo bebas ongkir nya jg  berbeda dgn aplikasi sebelah halo  sadar buka pesan email hp  email dipakai orang pembayaran PEGADAIAN 
