,Month,Original,Summary
0,2023-02,free ongkirnya semoga minimum pembelian promo cashback ya Minimal kayak website IPADOS  Intinya optimisasi ipad os  layar horizontal ya viewnya horizontal  developer otaknya dipake  Internet cepat aplikasi lelet banget mantap banget tokped aseli Been a while using this app and I  m satisfied always Tokopedia is the Best  Enough said  Mantabbbbbb membantu Sukses toko Hijau Sering2 promo kasih cashback ya  Promo gratis ongkirny balikin minimal pembelian 10rb min  Produk lengkap  ecommerce biaya aplikasi The best online store for selling and buying for me forever Laman Tokopedia Care chatt langsung dg CS   NgeHang Udh update     Barang terkirim tg 26  konfirmasi kurir Aja butuh ya  Firut jg gak respon  Penjual nya Car5On baby Shop jg responsible  diam Aja gak Boro2 bantuin  tolong Tokopedia selektif pilih seller  seller2 Spt teguran diblack list   Transaksi cepat pembayaran tagihan Barang yg dijual variatif  promonya transparan gratis ongkir y bgs y sy pake y Aplikasi membantu  navigasi enak  enteng  responsif  Love aman belanja tokopedia payment mudah mbanking harga terjangkau bnyk gratis ongkir pokonya terbaik  I use this app to buy everything  Tokped is best platform for my house needs thank you topup 2x  1x berhasil  1x nya uang gak masuk etoll Potongannya gede Mantapppp limit cicilan 0   Sampah Awwwwweuscome disayangkan Kartu kredit suka gagal Seru banget belanja karna simpel banet penggunaannya  desain web nya rapi jd ga pusing klo belanja Infus vitamin Customer care tindakan apapun pembeli melaporkan keluhan Official Store  Rating up deh for this app puas doang eh engga puas banget pembayaran pake tokopedia   simple  cepat   banyakin lg cash back nya   Tokopedia gratis ongkir  Love you tokopedia pake kemeja warna biru celana coklat  ketemu halte ya mas halte  jalan kesana Puas Banget sih  claim Free Ongkir nya gampang  pakai Credit Card  promo cashbacknya  gampang claim promonya Overal puas pake app tokped memudahkan belanja online  kurangi rekomendasi iklan barang yg cari  bener2 dapet barang yg terbaik sesuai ulasanrevisi customer yg membeli Tp 5   Mudah  Cepat  serba Sukses tokped  Terbaique  dr segi UI  payment methods  cust service solve refund dll  oke dibanding app online shopping Bagus  Best marketplace so far bagus jelek  fitur foto dagang gabisa zoom out  memble Marketplace yg kunjungi belanja kebutuhan bulanan Ongkirnya murah ngga ribet pembayaran The best  One of best OLshop  i always used it to bought my monthly necessity  Hopefully got many promo    Thanks toped  smoga saham mu booming  terbaik  terkendala  seller kurir  Meninjau toko rate sellernya Cashbacknya gokil membantu  Plus promo2 nya membantu nyaman belanja on line  Thanks Toko Pedia membantu berjualan second stuff  Terimakasih tokopedia praktis pilihan barang  jasa pilihan pembayarannya Asik belanja online aman Over all good thank you Cepat mantab sip pokok nya UInya nyaman barangnya oke Recomended buangetttttt dibanding yg onoh Belanja tokopedia    Tokopedia cashback untungnya Ecommerce recommended beli barangbarang otomotif  Trims lope u Oke mantab Toko online bersahabat  pakai mudah  diskon Apps bagus Delivery Plus smakin hr  kurir  pembelian makanan dr kota  usul review more improvement on all aspect n make simple shops pop up kali buka toped hubungkan gopay  mengganggu  biarkan sistem pembayaran  nggak pake pop up  toped kerjaan The best marketplace I really love the service and all of the seller Membantu dikala susah did you just removed  category  from the filters menu  Cepat amanah Always Have it ALL belanja mudah  mudah bayar nya Mantan Udah bayar status pesanan dibayar  Udah gt hubungin cs LAMAAA BGT tanggapannya  CS nya 1 orang kah   Gila kali duit gw 15 ilang gatau senang aplikasi tokopedia memudahkan transaksi online  aneka produk ditawarkan beragam penyelesain cepat terbantu beda aplikasi mengalami kendala jawabannya template  puas jualan tokopedia Joss tokopedia cuman payah nya kupon cashback diilangkan huhu jual pulsa fisiknya kaya voucher  ribet kalo jual pulsanya elktrik Toped  CepatMudahTerpercaya Aplikasinya mudah  simple Josssh Membantu membeli kebutuhan Love it so much membantu jualan  jempol helpful and useful app   Membantu bayar pajak PBB trus gede jg puas klo mkn murah dgn hrg segitu likeeee Pertahankan tingkatkan layanan upload produk jualan  tokped versi ios  update kog jdi save galeri produk yg udh udh upload  ga musti hapus  Tolong benerin min ni tokpednya  Help me a lot  Cashback toped mantap Promo cashbacknya diperbanyak  Proses pembayaran cepat Sayang bgt toko pedia  Thanks tokped  Very smart muantap oke oce oke oce Rahasia Bagus membantu yg pake Mudah aplikasinya friendly user  Tersedia pembayaran  ekonomis Penarikaan Puass  Barang cepat  oke pake SMS  Promo  diskon  freeongkir  cashback  pelayanan cepat  belanja mudah Kwalitas barang terpercaya Enaak asioy  jd mudah  kasih bonus ya Metode bayar pake aja bisaaa  Memudahkan pelanggan  Sering3 cashback yaa thankyou Mantabbb  belanjaa terossss puas Mantab jiwa  Aplikasi menemani berbelanja  Untung pay later by gojek  Cima biaya admin semoga turunkan  Lumayan belanja dì Tokopedia So much fun and efficient to shop here  For any chance some bad vendors did not proceed with shipping after receiving the payment and wait until time expiry which auto cancelled  this is not fair to most customers  There should be some penalties given to those vendors  Suka bgt Very good Tokopedia is The Best belanja tokped  Layanan cepat gampang yg kolom diskusi ulasan dimodifikasi  bikin ribet user Aplikasi mantap user friendly Pengalaman berbelanja MP menyenangkan  kemudahan menggunakannya  bikin asik kupon menguntungkannya  Good Job Tokopedia  Tokopedia TOP  Keren pokoknya  karya anak bangsa belanja beli token listrik tokped  aplikasi mudah dipakai  user friendly metode pembayaran  promopromonya  mengecewakan belanja tokopedia diskon diaplikasi  murah gratis ongkir promonyaMantap super love with the application Tokopedia simple bagus barang nya lengkap Lovit this  Wow bagus banget Star Tokopedia ok vzha aplikasi Tokped   beli voucher makan  pulsa  MTix  tiket kereta  beli pulsa beli tiket pesawat  Sukses Tokped  Aplikasi berat banget  internet minim gak buka aplikasi toped  buka si orange lancarlancar aja  Tolong perbaiki  gak berat2  biar calon pembeli nyaman browsing  penjual cepat proses pesanan pembeli  Kalo aplikasi berat gak dibuka  calon pembeli gak liat2 produk  foto aja gak  penjual cetak resi susahnya ampun  muter2 ber menitmenit  Senangnya belanja tokopedia pelayanan profesional  barang cepat update koq ulasan diskusi lapak seller hilang  gimana ngecek ulasan pembeli  Mohon diperbaiki  Trims Udah platinum badge udah happynya Dana refund yg klaim dikembalikan maksimal 2x24 jam  4x24 jam kejelasan mending toko oren sebelah bingung kali jajan toko ijo  baguuz  Favorite mengecewakan Request tokopedia seller iOS Toopppp Toppppp Bener2 bgt proses refund rekeningnya  pas transfer ga sampe 5 menit  aneh Naissss Tokopedia banyakin promo menarik update tiba2 suka  Aplikasi e commerce the best  OVO   mantap Terima kasih  Berguna banget belanja  Tp suka error reply diskusi barang  Semoga diperbaiki ya  Aga rempong si tampilannya ga user friendly Semoga mantap seller tuk banyakin fitur chat Pertahankan mantap Pengiriman cepat  barang sesuai deskripsi  Smoga awet  mudah ngapain halaman donasi diarahkan versi web  Mantap bagus toko sebelah Semoga Puas bgd sma pelayanan tokped top Promonya berkurang TOKO MARKET PLACE YG BIKIN KECEWA  pesan barang seharga 15jt tpi trima bantua,Mantabbbbbb membantu Sukses toko Hijau Sering2 promo kasih cashback ya  Promo gratis ongkirny balikin minimal pembelian 10rb min 
1,2023-03,Sering2 kasih diskon isi ulang belanja yaa  BTS BA nya Mudah suka tokopedia App mempermudah pembayaran tagihan komplain pembelian barang dikirim sesuai spec diselesaikan dg dibantu HELP aplikasi Toped Cari aja  dlm genggaman Promo Kartu Debit Mandiri please makasih Anti ribet2 Club  Gampang  cashback Semoga jaya terpercaya Coconut Yoghurt sedia Salah aplikasi ecommerce dimana membantu kebutuhan yg  apapun  cari aja  Tokopedia Sering2 gratis ongkir hehe PROMO  i can find everything pelayanannya membantu belanja rumah puas belanja tokopedia  Tokped nomor slalu slalu bissaaaa memudahkan Weell aplikasi belanja termudah Super good Apps membantu keperluan sehari2 Cepat Mudah recommended Good servis Nice app for online shopping beli bayar indomaret  pesanan dibatalkan tokopedia  saldonya gak refund  uang hilang ditelan tokopedia bdjngan Seneng banget belanja tokped  Susah login email no hp dah bener salahkan Suka banget Shopping app UI UX yg terbaik  Mudah memakainya  melacak pengiriman  uang cepat pembatalan Cepat resminya jaringan bagus joss nggak kendala ajaa Giod Mantap prosesnya cepat Bagus pelayanan nya  bonus nya jg mantap sat set sat set instan belanja tokopedia Aplikasi mudah cashback bantu penjualan ramai  akun toko pedia yg 1 jualan jalan  padaan bertahun2  kah jualan barang original memank bagus   x bantu bimbingan nya  tmn2 si maen open  males ajarin   Jujur gaptek  belajar kekurangan  pelupa dll  pribadi lim agus mulianto memohon toko pedia membantu ajarkan trik berjualan  sblom nya Terima kasih  sanggat berharap Tuhan kirim mencari rejeki plafon  Amin  tokopedia freeze berat  memuat search hape panas  sempaf uninstal instal  perubahan  Versi engga gini  Mohon diperbaiki ponsel lawas iphone Xr Awesome  Is the best pokok  e  Toped mantapp tanda bukti pembayaran  Teruntuk tokopedia  ngapain bikin kerjasama jasa ekspedisi pengiriman barang yg lelett  liat google appstore wih banget yg kasih rating 1 anter aja  yg baca order barang tokped sarang gw pake jasa anter aja kalo gamau nunggu lamaa banget barang udah kota  responsif cepat  kupon2 promo mesti dibanyakin shg org tertatik utk bertransaksi  Ok mantap Mantaaaaaappppppp Memuaskan top banget Mantul banget  pilihan produk harga bersaing free ongkos kirim  mantaaap Karya anak bangsa yg didukung  Semoga kedepannya berkembang menembus jaringan international goto  Terimakasih Good application  minimal error  relatively stable  Aplikasi favorit sy belanja online Top Banget Keren gampang banget belanjanya  user friendly     Bad Response from tokopedia care transaksi bermasalah 10 Februari 2023 san keputusan cs tokped care pengembalian dana   31 Maret 2023  dananya terima cs tokopedia care berbelit belit  responya  meberikan solusi Jujur pindah si orange  tokped  Pelayanannya bagus  promonya bejibun  user Gojek 2015 tokped bermitra gojek langsung full senyum  So far  pengalaman menghunakan tokped memuaskan  semoga kedepannya tokped berinovasi usernya nyaman  marketplace ya Tokopedia  gak butuh Kalo tambahin promonya hihii Dana ga masuk2  cs bertele2 Praktis  Meringankan Tokopedia mantap  belanja aman transaksi aman Tokopedia semoga jaya belanja online tokopedia Gass fulll Teman setia Mantapsss tokped  cashback nya Semoga lancar Tokopedia pedagang penipu yg mencoba mengirim apk  staf Tokopedia membasmi Pedagang yg jahat Bgusss poll membantu banget Puasa membantu membayar apapun toko pedia Tokopedia buka sdh tujuan berbelanja  top bgt krn mudah pemakaiannya Terima kasih tokopedia  Semoga berkembang Tampilan aplikasi simple bagus ringan  ga kaya apk sebelah berat bangett better drpd toko oren Keren ih Pokoknya terbaik  Biaya aplikasi kegedean memuaskan mudah Aplikasi seler center ios blm ya gabung aplikasi toped beli Best online shopping masyaallah tabarakallah Good Shopping App in Indonesia Ok bngt  Mudah  belanja onlie mudah lengkap kasino tokped mempermudah custumer  tks tokped Tokopedia top deh dlu sampe skg pane tokped Akurat  mudah praktis aman puas applikasi Good app  almost can find anything  from kids  toys to car spareparts Apps mantap top samgan membantu Pengiriman cepat I really enjoying this apps  but i need more promo cashback and all of that happiness things Ongkos gratis mulu kalo milih reguler  diskon  Terbaik  Tokopedia terbaik Seller centernya IOS Sering2 kasi promo free Ongkir  Biar semangat  belanja toped  puas beli pulsa tokped skrg u biaya kirim member tokped plus yg 6bln 150k   ga asikkk Dtxivonnm jchxyzxkbh hcyxfzgxh hvj M membantu usaha indonesia salam sukses Supporting radicalism in the office  No Fake Fake Items  puas banget belanja tokped  harga barang murah  diskon belanja pilihan ongkir yg ringan kantong puas belanja toped  sukses semoga mengudara jaya  Lancar ga lag metode pembayaran tersedia Lancar  app  Well done Sukaa Banget apps nya   Gak nyesel dehh pake aplikasi Tokopedia     anti ngelag lag club  Pake tokopedia 2011 2012an so far puas  Udah nyaman banget Good service simple Peri peri gut job aplikasi simple memudahkan  saran kedepannya tingkatkan paylater  masukan bikin chat mehubunhi ekspedisi kadang kadang terkendala ekspedisi  kasian toko sasaran klo keterlambatan karna aplikasi cuman chat penjual gak chat ekspedisiterimakasih mantaap      belanja terussss    Mantp ngasih cashback smoga sllu jaya Membantu belanja online voucher free ongkir skr    Mudah ne cepat Prefer si ijo drpd si oren  Aaaaaaaa ntab belanja online  Keren mudah Awsome promoo Aplikasi bagus user friendly The best place for shopping  You name it  they always have it  Pmj Kereeen   Belanja aman pendemi Mantap deh terpercaya Tokopedia    Shopee Recomended mudah kerja bagus Mudah belanjanya promonya berkualitas barang nya  Good job Jual beli gampang  ga ribet tq Apapun kebutuhannya Tokopedia solusinya Aplikasi terbaik belanja bayar tagihan Mantap jiwa raga mempesona Easy and safe  Mantap wes  belanja jd lbh mudah Puas  dikasih hadiah topedwkwkwk Berasa horang kaya  barang jenis apapun tersedia  Tinggal ambil  Ok dipertimbangkan Proses kilat Barang lengkap  easy to access Very useful use it for almost all my monthly needs  more Cari alat vacuum penis tokped ga ya  gue pengem gedein alat tempur gue 3  check out pakai kartu kredit ga  koneksi terputus ga submit button pilih jangka pembayaran kerenn bgt Maju GoTo  Sorry  No Koment Terpercaya lancar transaksinya Terimakasih Tokopedia pelayanan terbaik  5 pemakaian suka Real Pict yg dilebihlebihkan Toko Orange  Terimakasih  Semoga Jaya TOKOPEDIA INDONESIA mudah terpercaya pembelian online Membantu belanja dimasa pandemi Good enough pake tokopedia   memiliki pilihan menyimpan data kartu kredit  Terpaksa simpan data kk  memiliki opsi simpan dikenakan biaya 10rb  One of the best online shopping in indonesia Ol shop mudah favorit banget  Enak pakai gopay  Semoga sukses  diskonnya Beli songkok Pemalak Easy transaction and fast delivery I like it Skrg solusi kebutuhan elektronik  Terimakasih Tokopedia  yess Ongkos 100 rb Aplikasi stabil  reliable online shopping marketplace Mudah2an cocok enak bener Good good good Semoga undiannya Top handal nyaman Menyenangkan berbelanja toped Respon cepat   mudah dimengerti The one that beat Bukalapak  senang memakai Tokped Pertahankan Performanya Memudahkan ribet  Tp bijak berbelanja  Klo,No Fake Fake Items  puas banget belanja tokped  harga barang murah  diskon belanja pilihan ongkir yg ringan kantong puas belanja toped  sukses semoga mengudara jaya  Lancar ga lag metode pembayaran tersedia Lancar  app 
2,2023-04,penjual aktif app  berhenti sistem memuaskan  dapati barang kirimkan customer resinya ter update  cancel  untungnya chat customernya langsung barang smpai tangan customer  untungnya respon customer nya trf manual rekening   lakukan  sayang nya customer respon  chat barangnya terima respon  chat kalinya kerja samanya trf manual barang diterima ga respon  aman berjualan ditoko sebelah jualan tdak kejadian  langsung menghapus produk etalase takut membantu yg mager dgn jempol belanja   bestttt gg banget anjay Bagus senang  pilih tokped Good n good mantap Cv the best tokopedia bagus inovatif  pembayaran biaya akun love banget Ok simpel ga iklan riweuh kaya toko sebelah recomended seller  support and product mantap iphone 7 plus  aplikasi  satunya olshop yg ak percaya  2 x belanja brg tdk sesuai  and garansi uang d  thanks toped  sukses sll ya   Bagusss pelayanan Asd Easy to apply at anytime  anywhere Sukses It  s really good online shop for now Goodd quality Easily to use UI UX so far nyaman kompetitor Very good UI  easy to find the trusted products  variations of payments available  and many more  Like it seller potongannya gede banget  kendala  masyaa Allah  Sori bgt rating 1 nih tokopedia  topup e money gagal udh gatau kali  tokopedinya  tp ttp bertanggung ga gw isnya tokopedia  Tolong perbaiki  Must have app org indo mantaabs gk repor2 toko offline market Bikin belanja gampang Yeahhh Pokoknya aman deh transaksinya Top deh pokoke  Cepat  praktis  tdk berteletele  bagus Cocok aj belanja tokped Ya Tuhan banget potongan admin fee diambil ga ikhlas   padhal 45  tp 5  ditarik danaku dr penghasilan  sad banget ga sesuai  tolong market placenya jd bikin susah seller kepotong feenya  tolong jujur ni aplikasi jgn enaknya motong 45   kecewa bgt Good application and support buyer overall im happy and always using this application Kereeen jaya trus toped Keren nonton film nice  Puas banget kenyamanan mencari produk  permasalahan  pusat resolusi sigap membantu  dibikinin ruang chat si resolusi pengengah penjual pembeli  it helps so much  Aplikasi tercanggih termudah membantu Thanks to toped mempermudah belanja  Semoga kasih promo  bayar tagihan mudah pakai tokopedia  keamanan pembayaran transaksi online Tokopedia   Two thumbs up belanja dimanapun   simpel  mudah  cepat  lemot andalan Thanks Gopay utk layananhadiah 500rb utk buka Gopay  prima utk membina TRUST sellerbuyerProviderTokopedia  Tambahan  tolong proses pembatalan proses dgn cepat  Indonesian great online shop Most of its sellers are trustworthy  any problems that came up after the purchase were professionally solved with full support of both Tokopedia andor the sellers  I am very satisfied with it  repot praktis Easy to use app  reliable with wide selection of goods and services  Terima kasih Tetep jaga toko2 yg kredibel Tingkatan fitur voucher nya kalo dipake ya dipake  belanja pake gratis ongkir 20rb trs batalin gabisa pake gratis ongkir 17 rb sekian trs top dipake gratis ongkir 20rb nya Mudah  Murah  Cepat   puas klo belanja tokopedia Suka pelayanan tokopedia tokopedia Very user friendly  barang lengkap membantu menemukan barang yg  Terima kasih Tokopedia Advised to read the testament first then you decide  Bagus Puas mudah  ga error  kerenn pake Tokped oke sih  gak kendala  Thank you  Tokopedia ecommerce favorit okee Standar  original promo pilihan official store nya memudahkan wabah  Semoga sehat2 ya  dlu skrg pakey tokopedia aja Bayar listrik dapet cashback Joskan Beli tokopedia kena tipu  produk dikirim deskripsi gambar produknya   promo gratis ongkir  penjual biaya potongan administrasi nya  Mantap promo jenius yess Good apps great feature  keep going Ez to use Thanks Tokopedia Dpt potongan hargaa  belanja online terdebest  Tokopedia solusi keuangan Really enjoy my shopping Naisuuu  i write this one to celebrate harbolnas Biaya ongkir anteraja sicepat dinaikan 63rb  dikasih promo bebas ongkir senilai 40rb  dikonternya anteraja sicepat biaya ongkir 40rban  kesimpulannya tokopedia niat kasih promo bebas ongkir alias promo jebakan  pelopor online shop TIPUTIPU  senang belanja toko pedia gratis ongkirnya please support more customer Naikan harga saham GOTO Hukumnya  promo nyantol sm aplikasinya  bagus berat membuka toko toko loading lambat A6jabf Aplikasi nya menyenangkan aman Yeay Sy suka bagus bgt aplikasinya aman  cepat bagus kasih 5 bintang  informatif memudahkan pembeli memutuskan membeli penjual  marketplace favorit anti ngelag ngelag club Bagus  lengkap mudah banget belanja online Mudah  barang range harga berbedabeda  Mantapp tokopedia ga kecewa  udah ga tokopedia now ya  Jakarta selatan Great app keep improving the apps so that much easier to use for everyone Lumayan suka bagi2 cashback ovo  Anjaay mabar bareng tokped Marketplace bangsa  mari dukung  berkolaborasi aplikasi Indonesia nyaman berbelanja tokopedia  Hijau nyaman mata jempol  1 klaim tdk klasifikasinya aplikasi tokped   chat terhubung dgn mesin  tokped musti menyediakan realtime  real orang yg respon lgs  mesin 2gagal bayar krena mslh aplikasijaringan  pilihan pembelian hilang  pilih ulang yg menghabiskan  pilihan tersimpan kranjangwishlist 3  pembayaran krena salah klik  status waiting pembayaran  tp tetep tdk pembayaran krena tdk pilihan bayar yg pilihan batal hub cuscare Another purchase from this store as regular ordered and fast Dahsyat user friendly apps Udah aja User friendly   teratur  promosi menyenangkan  uang aman transaksi batal  Bayar PBB gak antri gak ribet  terbantu  joss singkat cepat tehnik model pembeliannya Suitable for ipad  Ga tau knapa make ijo suka ketimbang yg or  nge atopun p  nk Aman  nyaman terpercaya Mantap aplikasi tokopedia pelayanannya  seringseringin keluarin voucher  Biar semangat buyernya  Hahha   kewreeenn Good and Fast Aps mudah  seller  pilihan produk  jeli produk asli Simple and secure Tokopedia aplikasi yg user friendly  dipakai orang  yg membantu meningkatkan ekonomi rakyat  Cepet mudah Budi Mudah dipakai jarang scammer  mohon bersihkan yg penjual penjual preorder yg jarang memenuhi orderan  ngga tombol blokir penjual liat jualannya kolom pencarian produk  Tokped asli anak bangsa suka  Keren smkn terdepan Nice and easy user interfacenya bagus  promonya skrg banyakan tokped  kurangnya pilihan barang beragam dijadikan andalan   Qcool23 Bagussssss Dibanding shopee jarang barang COD rumah lowongan kerja gak  top is the best Buktikan kako Cashback tokopedia pilih2 Nice aplikasi Pokoknya tokped idolaku    belanja online yg mantap dah Beda banget tetangga sebelah gencarin iklan doank tokped laternya donk Termudahkan lengkap top Puas banget pelayanan tokopedia Mnatap membantu aplikasi nya 1 pelayanan 2 kali paket dikirim Thank you 6 nya yg menemani Terpaksa pindah makasih sdh kali batalakan pesanan sistem  sdh bayar bikin ribet aja Makasih loh  Beli blush on She glam dapet diskon  Senangnya   Top markotop smoga berkembang Tokopedia okee pro Interfacenya juara dibanding aplikasi belanja  jarang bgt force close  yg transaksi amaan jaya Pelanggan setia cokopediahhh gandi Mantab oke  Multi function app Hallo sy user iphone 8plus ios 13x update applikasi tokped tp applikasinya crash  gabisa dibuka dibuka nutup Discount nya krg  asuransi tdk berguna  berdasarkan pengalaman susah urusnya tdk berhasilutk chat cust susah  sempet,berkolaborasi aplikasi Indonesia nyaman berbelanja tokopedia 
